<?xml version="1.0" encoding="UTF-8"?>
<!-- W3C Schema generated by XMLSpy v2018 rel. 2 (x64) (http://www.altova.com) -->
<xs:schema xmlns:xs="http://www.w3.org/2001/XMLSchema">
	<xs:element name="ID">
		<xs:simpleType>
			<xs:restriction base="xs:string">
			</xs:restriction>
		</xs:simpleType>
	</xs:element>
	<xs:element name="GEO">
		<xs:complexType>
			<xs:sequence>
				<xs:element ref="ID"/>
				<xs:element ref="DESC"/>
			</xs:sequence>
			<xs:attribute name="start" use="optional">
				<xs:simpleType>
					<xs:restriction base="xs:integer"/>
				</xs:simpleType>
			</xs:attribute>
			<xs:attribute name="end" use="optional">
				<xs:simpleType>
					<xs:restriction base="xs:integer"/>
				</xs:simpleType>
			</xs:attribute>
			<xs:attribute name="filt">
				<xs:simpleType>
					<xs:restriction base="xs:string">
						<xs:enumeration value="B"/>
						<xs:enumeration value="C"/>
					</xs:restriction>
				</xs:simpleType>
			</xs:attribute>
		</xs:complexType>
	</xs:element>
	<xs:element name="DESC">
		<xs:simpleType>
			<xs:restriction base="xs:string">
			</xs:restriction>
		</xs:simpleType>
	</xs:element>
	<xs:element name="SCL_GEO">
		<xs:complexType>
			<xs:sequence>
				<xs:element ref="GEO" maxOccurs="unbounded"/>
			</xs:sequence>
		</xs:complexType>
	</xs:element>
</xs:schema>
